<?xml version="1.0" encoding="UTF-8"?>
<!ELEMENT konyvek (konyv)>
<!ELEMENT konyv (cim,ev,kiado,szerzo+,leirasabst?,id)>
<!ELEMENT cim (#PCDATA)>
<!ELEMENT ev (#PCDATA)>
<!ELEMENT kiado (#PCDATA)> 
<!ELEMENT szerzo (#PCDATA)>
<!ELEMENT leirasabst (#PCDATA)>
<!ELEMENT id (#PCDATA)> 
